id,title,abstract,year,author_ids,source
b4f8206361ca9e0a9ff25e55292826c2a490c2d3,"Hybrid deep learning CNN-LSTM model for forecasting direct normal irradiance: a study on solar potential in Ghardaia, Algeria","This paper provides an in-depth analysis and performance evaluation of four Solar Radiance (SR) prediction models. The prediction is ensured for a period ranging from a few hours to several days of the year. These models are derived from four machine learning methods, namely the Feed-forward Back Propagation (FFBP) method, Convolutional Feed-forward Back Propagation (CFBP) method, Support Vector Regression (SVR), and the hybrid deep learning (DL) method, which combines Convolutional Neural Networks and Long Short-Term Memory networks. This combination results in the CNN-LSTM model. Additionally, statistical indicators use Mean Squared Error (MSE), Root Mean Squared Error (RMSE), Mean Absolute Error (MAE), Mean Absolute Percentage Error (MAPE), and Normalized Root Mean Squared Error (nRMSE). Each indicator compares the predicted output by each model above and the actual output, pre-recorded in the experimental trial. The experimental results consistently show the power of the CNN-LSTM model compared to the remaining models in terms of accuracy and reliability. This is due to its lower error rate and higher detection coefficient (R2 = 0.99925).",2025,2312605618|2284078706|9720214|30976686|2202586161|2316111399|51441905|1492126833,semantic_scholar
9ab9eb5caf3c746d5928c4b7b8d49d7ed79394ac,"Intercomparison of sediment transport curve and novel deep learning techniques in simulating sediment transport in the Wadi Mina Basin, Algeria",,2025,2258235228|94985814|1450798511|2309408012|2339110639,semantic_scholar
534a30a3daefebc1a37273336254b82d7fd8abb0,Transfer learning-based deep learning models for flood and erosion detection in coastal area of Algeria,,2025,2222806205|1380311710|107641223|3419747,semantic_scholar
c827f802213d2ef539874d05360e9f31d2f76889,Monitoring Desertification in Adrar Algeria Using Deep Learning and Spectral Indexes with Landsat-8 Images,,2025,2230484321,semantic_scholar
ac19eb4080d46ff4c122611eb4ff52e9d9c42410,"Assessment of machine and deep learning models integrated with variational mode decomposition for photovoltaic power forecasting using real-world data from the semi-arid region of Djelfa, Algeria",,2025,2368202922|30876093|2124419399|2344286,semantic_scholar
119527bb70e7fa6a5519ca285c93be4960eb88ac,A Deep Learning Model to Classify Forest Fires Burned Areas Using Sentinel-2 Data in Algeria,,2025,2230484321,semantic_scholar
23f2f4c34b419de55b31a25e7d0bc34d2b2a7b40,"Deep Learning-Based Bayoud Disease Recognition Using Palm Fronds Database From Biskra Region, Algeria","Early Recognition of plant diseases is required to provide appropriate treatments and protect agricultural production. Automated image detection techniques can provide early, fast, accurate, and inexpensive detection results. However, scientific research on date palm diseases is even rare due to the limited number of databases, including the Bayoud disease. In this paper, a new database, Biskra Algeria Palm Fronds Database (BAPFD), containing 400 images of date palm fronds is proposed, it includes images of both healthy and Bayoud disease-affected fronds. The Deep Learning (DL) technique is then used to classify our database and recognize Bayoud disease in date palm fronds. The performance of our approach is measured in terms of accuracy, loss, precision, and recall. The mentioned experimental results show that the proposed approach based on DL achieved high performance in recognizing Bayoud disease in date palm fronds, up to 100% for precision and recall and in order of 4×10–4 for loss. The results show also that the model is capable to accurately classify infected and not infected fronds images even with a small percentage of bayoud. This demonstrates that our database contains significant information concerning bayoud diseases, which enables DL to design an accurate model that aids in correctly classifying palm fronds and identifying Bayoud disease. We further acknowledge the effectiveness of the DL approach in the recognition of healthy and not healthy fronds.",2024,2303572542|2303572714|2303570756|2102500185|2303570713,semantic_scholar
a516467c5e7b45b97bcd221b073cbf756930f620,Mapping Agricultural Greenhouses in Algeria: A Deep Learning Approach,"Agricultural Greenhouses (AGs) are increasingly crucial in global food security, particularly in arid and semi-arid regions like the Maghreb, where they offer sustainable solutions to water scarcity and climate change challenges. Despite their growing importance, the precise extent and distribution of AGs in these regions remain poorly mapped, largely due to the limitations of traditional survey methods and the diverse nature of AG infrastructures. This study introduces a novel, deep learning-based approach to map AGs in the Maghreb, focusing on a 20-year case study in Biskra, Algeria (2000-2024). Employing remote sensing with Landsat imagery and the U-Net deep learning architecture, this research aims to provide a detailed, temporal mapping of AGs, offering insights into their dynamics and informing sustainable agricultural policies in the region.",2024,2303580210|152581957|2303582245,semantic_scholar
7fd14c914450fd8b15d04b3d5dd8045bf09a6ce0,"Forecast analysis of hybrid renewable energies using deep learning: A case study with data from the Capricorn FLX 202004 weather station in Biskra, Algeria","The intermittent nature of renewable energy sources makes it extremely challenging to predict the quantity of energy produced. This is due to the continuous variation in weather conditions, including the amount of solar radiation at the production site, wind speed, temperature, rainfall, and other factors. In our work, we conducted an analytical study using a massive dateset collected by the Capricorn FLX 202004 weather station, which is affiliated with the Laboratory of Hydraulic and Hydrological Engineering and Water Resources Development at the University of Biskra, Algeria (LARHYSS). In this analytical study, we utilized deep learning methods , which has proven its ability in analyzing big data. We performed this process to facilitate the fieldwork carried out by companies interested in investing in clean electricity production in the region. Through this statistical weather forecasting technique, we provided valuable insights for researchers in the field of designing emerging energy production networks to identify the best locations for constructing hybrid power stations that combine solar and wind energy.",2024,2303594606|2283196106|2975602|2269459996|2303597254|6697928|2383711072|2269457249|2269457247,semantic_scholar
4005dc4fc70e5fb9addd0a1c98aa2a5f4c3bfb07,"Deep learning in managing SARS-CoV-2 pandemic, variant prediction and driver mutation identification: Case study in Setif, Algeria","The COVID-19 caused damage across the globe since it first surfaced in 2019, and even after the worldwide health emergency, researchers are still working hard to comprehend the mechanisms underlying Severe acute respiratory syndrome SARS-CoV-2 mutation and transmission. This article presents a molecular screening study conducted on SARS-CoV-2 ribonucleic acid (RNA) extracts in the wilaya of Setif, Algeria, highlighting the critical role of bioinformatics and machine learning in addressing the COVID-19 pandemic. By leveraging advanced computational techniques, the study identifies mutations and variants responsible for epidemic peaks, offering valuable insights for future predictions and therapeutic interventions. The research employs various machine learning models, including deep multilayer perceptrone (MLP), k-nearest neighbours (KNN), and support vector machine (SVM), to detect Covid-19 variants and mutations with varying degrees of accuracy and precision. Deep MLP demonstrates promising performance in identifying both variants and mutations, as well as its significant role in managing health care pandemic and tragedies.",2024,2335894925|6252492|51175491|40652153,semantic_scholar
2d9b5c76df5895e4323c666128166b38d3cff541,Automated classification of geological core images by extraction region in Algeria: a deep learning approach,,2024,2332014032|9284725|2332017445,semantic_scholar
46e9b3b6830c83acf57422c0be4ac81baca2b758,Application of Deep Learning Neural Network for Mapping Groundwater Productivity Potential: Case of Cheliff Basin-Algeria,,2023,108020916|118275102,semantic_scholar
3f696ab1c398f27a81ae8d74fde02086a46f144f,Photovoltaic Power Forecasting using AI techniques and LSTM Deep Learning Network in Southern West of Algeria,"The accurate forecasting of photovoltaic (PV) power refers to the ability to predict the amount of electrical energy that will be generated by a photovoltaic system in response to given irradiation and temperature. This forecast is important for several reasons, including optimizing the system's performance, facilitating energy trade and managing network integration. In this article, Long Short Term Memory (LSTM) neural network are used for forecasting the output power of a photovoltaic power generation station using a set of historical time series data composed of photovoltaic power, irradiation and temperature. The data has been collected by the measuring environmental variables and generated power every 15 minutes from a station located in the city of Adrar in the Southern West of Algeria. The accuracy of the LSTM based model is compared to other classic models such as ANFIS and ANN for the same conditions. The results of the trained LSTM model show a slight difference between the forecasted and measured power with a Mean Absolute Error (MAE) value equal to MAE= 127.10. The training and evaluation of the PV power forecasts by other techniques give an average accuracy MAE= 1.3857 for the ANN model, and MAE=3.0052*10-4 for the ANFIS model.",2023,2284082371|1712132884|2264351458|9330473|1743345,semantic_scholar
de70cfe062a6f439494118132812caa60561150d,Deep Learning for Statistical Downscaling of Daily Mean Temperature over Northwestern Algeria Using CMIP6 Data,"Accurate and high-resolution regional climate projections are essential for effective water resource management and climate adaptation, particularly in semi-arid regions such as northwestern Algeria. In this study, we develop a region-specific deep learning framework based on a Convolutional Neural Network (CNN) to statistically downscale daily mean temperature using CMIP6 large-scale climate predictors. The framework incorporates carefully selected predictors, including topography, distance to the sea, and key synoptic-scale ERA5 variables, and employs a robust training strategy based on the Huber loss function to enhance stability in the presence of occasional extreme temperature values. Results demonstrate that even a relatively compact CNN consistently outperforms a baseline multiple linear regression model, with the regional explained variance (R 2 ) increasing from 0.8407 to 0.9116, RMSE decreasing from 4.059 °C to 3.339 °C, and MAE reduced from 3.269 °C to 2.683 °C. These improvements highlight the CNN’s ability to capture physically coherent relationships between local physiographic factors and large-scale atmospheric predictors, producing a more accurate spatial representation of temperature variability. Additional diagnostics further confirm the robustness of the proposed framework in reproducing both mean climate characteristics and spatial error structures. Overall, the study demonstrates the potential of deep learning as a powerful and transferable tool for statistical climate downscaling over Algeria and similar climate-sensitive regions.",2026,2408099134|2408098859|2275447789|93335527|2326144064|2256525378,semantic_scholar
21c830584a7705e6cce76256ed39b0d8417b0b1f,"Evaluation of Groundwater Quality for Irrigation in Deep Aquifers Using Multiple Graphical and Indexing Approaches Supported with Machine Learning Models and GIS Techniques, Souf Valley, Algeria","Irrigation has made a significant contribution to supporting the population’s expanding food demands, as well as promoting economic growth in irrigated regions. The current investigation was carried out in order to estimate the quality of the groundwater for agricultural viability in the Algerian Desert using various water quality indices and geographic information systems (GIS). In addition, support vector machine regression (SVMR) was applied to forecast eight irrigation water quality indices (IWQIs), such as the irrigation water quality index (IWQI), sodium adsorption ratio (SAR), sodium percentage (Na%), soluble sodium percentage (SSP), potential salinity (PS), Kelly index (KI), permeability index (PI), potential salinity (PS), permeability index (PI), and residual sodium carbonate (RSC). Several physicochemical variables, such as temperature (T°), hydrogen ion concentration (pH), total dissolved solids (TDS), electrical conductivity (EC), K+, Na2+, Mg2+, Ca2+, Cl−, SO42−, HCO3−, CO32−, and NO3−, were measured from 45 deep groundwater wells. The hydrochemical facies of the groundwater resources were Ca–Mg–Cl/SO4 and Na–Cl−, which revealed evaporation, reverse ion exchange, and rock–water interaction processes. The IWQI, Na%, SAR, SSP, KI, PS, PI, and RSC showed mean values of 50.78, 43.07, 4.85, 41.78, 0.74, 29.60, 45.65, and −20.44, respectively. For instance, the IWQI for the obtained results indicated that the groundwater samples were categorized into high restriction to moderate restriction for irrigation purposes, which can only be used for plants that are highly salt tolerant. The SVMR model produced robust estimates for eight IWQIs in calibration (Cal.), with R2 values varying between 0.90 and 0.97. Furthermore, in validation (Val.), R2 values between 0.88 and 0.95 were achieved using the SVMR model, which produced reliable estimates for eight IWQIs. These findings support the feasibility of using IWQIs and SVMR models for the evaluation and management of the groundwater of complex terminal aquifers for irrigation. Finally, the combination of IWQIs, SVMR, and GIS was effective and an applicable technique for interpreting and forecasting the irrigation water quality used in both arid and semi-arid regions.",2023,2090448085|88757975|2328228213|49591684|84040281|90915606|81402431|90578281|2200338232|89875648,semantic_scholar
099779f04a4ea21b2d2ca986d4c033aa9cb5e73a,SPubBin: Smart Public Bin Based on Deep Learning Waste classification An IOT system for Smart environment in Algeria,,2022,1415122435|3130658|2190526227|2190526300,semantic_scholar
3b0e17f35f649302346f6487b3126face0f80859,A robust deep learning approach for photovoltaic power forecasting based on feature selection and variational mode decomposition,"Accurate forecasting of photovoltaic (PV) power is essential for effective grid integration and energy management, particularly in solar-rich regions such as Algeria. This study presents a robust forecasting framework that combines advanced feature selection techniques with deep learning architectures---namely MLP, GRU, LSTM, BiLSTM, and CNN---to enhance daily PV power prediction accuracy. Three feature selection methods---ReliefF, Minimum Correlation, and Minimum Redundancy Maximum Relevance (MRMR)---are employed to identify the most relevant input variables from a dataset collected in the Ghardaia region. Among the selected predictors, Global Solar Radiation (GSR) consistently proves to be the most influential. To further enhance model inputs, Variational Mode Decomposition (VMD) is applied to extract informative Intrinsic Mode Functions (IMFs) from the selected features. A comparative evaluation of the models indicates that recurrent neural networks, particularly GRU and LSTM, deliver superior performance across various metrics, including RMSE, MAE, nRMSE, nMAE, R², and the correlation coefficient. The GRU model achieves the best results, with an RMSE of 3.246 and an R² of 0.9550 using five IMFs. These findings highlight the effectiveness of integrating optimal feature selection, signal decomposition, and deep learning for reliable PV power forecasting. The proposed hybrid approach provides a practical and scalable solution for enhancing energy planning and operational efficiency in high-solar-potential regions.",2025,2364031877|2079543503|72854656|51441905|2363652139|2222706306|2316111399|2363654750,semantic_scholar
eddf16f5b4182d683bf18f876821fe6ff19c38a8,Integrated Remote Sensing and Deep Learning Models for Flash Flood Detection Based on Spatio-temporal Land Use and Cover Changes in the Mediterranean Region,,2025,2222806205|1380311710|107641223|3419747|2304241093|2282210703|1405251937,semantic_scholar
eda3dd620fef27f5f99a735d04b0990e7180446a,"Optimizing Landslide Susceptibility Mapping in Oued Guebli Watershed: A Comparative Study of Deep Learning, Support Vector Machines, Logistic Regression with Spatial Validation and AUC-ROC Analysis",,2025,2316658850|2096013322|2316656955,semantic_scholar
06b5ac672687bad7bafe7ee4e2e58972dc8e352e,Robust Deep Learning for Cereal Crop Classification with Noisy Training Labels,"Global land cover products, such as ESA WorldCereal, are known to exhibit biases due to their reliance on training data primarily sourced from Europe and the US. This limitation negatively affects their accuracy and effectiveness in regions like Africa and Asia, particularly for local agricultural mapping. We observed this directly in the context of cereal crop mapping in Algeria, where the inconsistency between local conditions and the training data is pronounced. To address this challenge, we present a methodology designed to improve cereal crop mapping in Algeria by mitigating the impact of noisy labels present within the ESA WorldCereal data. Our approach integrates adaptive morphological operations, a Co-Teaching paradigm, and the Generalized Cross-Entropy (GCE) loss. This synergistic combination functions to reduce the influence of both biased and noisy data, thereby enhancing the robustness and accuracy of deep learning models for regional-specific applications. Consequently, this approach facilitates more reliable agricultural monitoring and supports sustainable development efforts.",2025,71562503|1417914784,semantic_scholar
e7a438b110c4da4b83ba4ab03ca90dc30b219b2c,Ensemble machine learning model for exploration and targeting of Pb-Zn deposits in Algeria,,2025,2343937523|36168848|1380311710|2222806205|2282210703|2223713712,semantic_scholar
f74e1f11a0aca8fe6348f7bfe06db9576b15101e,"Medium-Term Electricity Consumption Forecasting in Algeria Based on Clustering, Deep Learning and Bayesian Optimization Methods",,2021,2031866252|153935708|21845095|1397728402,semantic_scholar
40130fb8011d8075de055d09fc5bb22d4b7612a1,Harnessing Deep Learning for Real-Time Water Quality Assessment: A Sustainable Solution,"This study presents an innovative approach utilizing artificial intelligence (AI) for the prediction and classification of water quality parameters based on physico-chemical measurements. The primary objective was to enhance the accuracy, speed, and accessibility of water quality monitoring. Data collected from various water samples in Algeria were analyzed to determine key parameters such as conductivity, turbidity, pH, and total dissolved solids (TDS). These measurements were integrated into deep neural networks (DNNs) to predict indices such as the sodium adsorption ratio (SAR), magnesium hazard (MH), sodium percentage (SP), Kelley’s ratio (KR), potential salinity (PS), exchangeable sodium percentage (ESP), as well as Water Quality Index (WQI) and Irrigation Water Quality Index (IWQI). The DNNs model, optimized through the selection of various activation functions and hidden layers, demonstrated high precision, with a correlation coefficient (R) of 0.9994 and a low root mean square error (RMSE) of 0.0020. This AI-driven methodology significantly reduces the reliance on traditional laboratory analyses, offering real-time water quality assessments that are adaptable to local conditions and environmentally sustainable. This approach provides a practical solution for water resource managers, particularly in resource-limited regions, to efficiently monitor water quality and make informed decisions for public health and agricultural applications.",2024,2000738354|2259024898|2262284902|2149955239|89399811|2205269026|13663193|2319528574|22334032|2269761231|2233016052|2037968768,semantic_scholar
51cfe39d57073580a7aa76bc84f588c92c1b506f,"Modeling and evaluation of urban growth: a comparative approach between XGBoost and deep neural networks coupled with multi-criteria analysis: case of BouSaâda, Algeria",,2025,2392515339|2163000969|108000299,semantic_scholar
8e73c6d61afebf54f1d98f50ec5294dd1b34296e,Deep Learning for Retinal Degeneration Assessment: A Comprehensive Analysis of the MARIO Challenge,"The MARIO challenge, held at MICCAI 2024, focused on advancing the automated detection and monitoring of age-related macular degeneration (AMD) through the analysis of optical coherence tomography (OCT) images. Designed to evaluate algorithmic performance in detecting neovascular activity changes within AMD, the challenge incorporated unique multi-modal datasets. The primary dataset, sourced from Brest, France, was used by participating teams to train and test their models. The final ranking was determined based on performance on this dataset. An auxiliary dataset from Algeria was used post-challenge to evaluate population and device shifts from submitted solutions. Two tasks were involved in the MARIO challenge. The first one was the classification of evolution between two consecutive 2D OCT B-scans. The second one was the prediction of future AMD evolution over three months for patients undergoing anti-vascular endothelial growth factor (VEGF) therapy. Thirty-five teams participated, with the top 12 finalists presenting their methods. This paper outlines the challenge's structure, tasks, data characteristics, and winning methodologies, setting a benchmark for AMD monitoring using OCT, infrared imaging, and clinical data (such as the number of visits, age, gender, etc.). The results of this challenge indicate that artificial intelligence (AI) performs as well as a physician in measuring AMD progression (Task 1) but is not yet able of predicting future evolution (Task 2).",2025,2183523174|1471428958|2742744|1727789|1825142|2191017229|2316757478|2319207900|2338410254|2316798930|2237638888|88990714|2365036347|2360714034|2360715576|2278451426|2278618838|1527091060|2364932325|2370932321|2359450789|2359443881|1393794367|2204465245|52331588|2154606862|1567778341|2359441556|2361031472|2320526915|9437414|2274304853|2365037392|2365038903|2365036600|2365035079|41211979|2365042147|2364938868|2218495096|2354338523|2260365519|2365039347|2303908964|2365035362|2365035254|1974436|2160608|2145305725|1684052,semantic_scholar
0c7ad13a7e119d36ee080073d6cc5de6ae836fd1,Optimizing Daily Streamflow Forecasting Under Mediterranean Climate: A Novel Hybrid VMD-EWT and Deep Learning Framework,,2025,2307979584|2078792986|2191866124|3462452|96810301|89479473,semantic_scholar
910ef14fe82b09a5d31a19e1c7332c144b2fa661,Short-Term Solar Power Prediction with Weighted Fusion of Deep Learning and Regression Models Using Multivariate Weather Variables,"Accurate short-term prediction of solar power generation is essential for intelligent energy management, as it enables the reliable integration of renewable energy sources into electrical grids and supports optimal operational planning. However, the nonlinear and intermittent nature of solar irradiance requires robust predictive approaches capable of effectively leveraging meteorological data through advanced artificial intelligence techniques. The present study develops a hybrid multi-model prediction framework that combines three complementary methods: BiGRU (Bidirectional Gated Recurrent Unit), CNN (Convolutional Neural Network), and SVR (Support Vector Regression). These models are individually trained using multivariate meteorological time series data—temperature, relative humidity, wind speed, atmospheric pressure, and solar irradiance—recorded at 15-minute intervals from a ground-mounted photovoltaic system located in M’sila, Algeria, during the year 2019. To enhance prediction accuracy, a Differential Weighting Strategy (DWS) is employed, dynamically adjusting each model’s contribution based on its recent predictive performance. The Pearson Correlation Coefficient (PCC) is applied to select the most influential input features. Experimental results show that the DWS-based fusion model significantly outperforms the individual models, achieving an R2 of 0.9952, RMSE of 0.9895, MBE of 0.2250, and MAPE of 9.3723%. These outcomes confirm the reliability and effectiveness of the proposed approach for solar power prediction under real-world conditions.",2025,68976402|2421847408|2204205674,semantic_scholar
65a0183b0ff128f2a0f8002fc66ee21d71f0b9ce,Deep Learning for Retinal Degeneration Assessment: A Comprehensive Analysis of the MARIO AMD Progression Challenge,,2025,2183523174|1471428958|2742744|1727789|1825142|2191017229|2316757478|2319207900|2338410254|2316798930|2237638888|88990714|2365036347|2360714034|2360715576|2278451426|2278618838|1527091060|2364932325|2226600284|2359450789|2359443881|1393794367|2204465245|52331588|2154606862|1567778341|2359441556|2361031472|2320526915|9437414|2274304853|2365037392|2365038903|2365036600|2365035079|41211979|2365042147|2364938868|2218495096|2354338523|2260365519|2365039347|2303908964|2365035362|2365035254|1974436|2160608|2145305725|1684052,semantic_scholar
