id,title,abstract,year,author_ids,source
9cd06fd2c1929710f018adec93355ae3df3f6f59,Spatial Monitoring and Insect Behavioural Analysis Using Computer Vision for Precision Pollination,"Insects are the most important global pollinator of crops and play a key role in maintaining the sustainability of natural ecosystems. Insect pollination monitoring and management are therefore essential for improving crop production and food security. Computer vision facilitated pollinator monitoring can intensify data collection over what is feasible using manual approaches. The new data it generates may provide a detailed understanding of insect distributions and facilitate fine-grained analysis sufficient to predict their pollination efficacy and underpin precision pollination. Current computer vision facilitated insect tracking in complex outdoor environments is restricted in spatial coverage and often constrained to a single insect species. This limits its relevance to agriculture. Therefore, in this article we introduce a novel system to facilitate markerless data capture for insect counting, insect motion tracking, behaviour analysis and pollination prediction across large agricultural areas. Our system is comprised of edge computing multi-point video recording, offline automated multi-species insect counting, tracking and behavioural analysis. We implement and test our system on a commercial berry farm to demonstrate its capabilities. Our system successfully tracked four insect varieties, at nine monitoring stations within polytunnels, obtaining an F-score above 0.8 for each variety. The system enabled calculation of key metrics to assess the relative pollination impact of each insect variety. With this technological advancement, detailed, ongoing data collection for precision pollination becomes achievable. This is important to inform growers and apiarists managing crop pollination, as it allows data-driven decisions to be made to improve food production and food security.",2022,71956769|2139441933|40024803|2483748|1796608,semantic_scholar
0c3a18ec9165932dc585e5682323853f80875fec,Mixed Differential Privacy in Computer Vision,"We introduce AdaMix, an adaptive differentially private algorithm for training deep neural network classifiers using both private and public image data. While pre-training language models on large public datasets has enabled strong differential privacy (DP) guarantees with minor loss of accuracy, a similar practice yields punishing trade-offs in vision tasks. A few-shot or even zero-shot learning baseline that ignores private data can outperform fine-tuning on a large private dataset. AdaMix incorporates few-shot training, or cross-modal zero-shot learning, on public data prior to private fine-tuning, to improve the trade-off. AdaMix reduces the error increase from the non-private upper bound from the 167–311% of the baseline, on average across 6 datasets, to 68-92% depending on the desired privacy level selected by the user. AdaMix tackles the trade-off arising in visual classification, whereby the most privacy sensitive data, corresponding to isolated points in representation space, are also critical for high classification accuracy. In addition, AdaMix comes with strong theoretical privacy guarantees and convergence analysis.",2022,35838711|16163297|2040617|1682008|81338045|1715959,semantic_scholar
89e5e7665e3b8bf9bf675400fa31d23300d62ea5,Learning to Resize Images for Computer Vision Tasks,"For all the ways convolutional neural nets have revolutionized computer vision in recent years, one important aspect has received surprisingly little attention: the effect of image size on the accuracy of tasks being trained for. Typically, to be efficient, the input images are resized to a relatively small spatial resolution (e.g. 224 × 224), and both training and inference are carried out at this resolution. The actual mechanism for this re-scaling has been an afterthought: Namely, off-the-shelf image re sizers such as bilinear and bicubic are commonly used in most machine learning software frameworks. But do these re sizers limit the on-task performance of the trained networks? The answer is yes. Indeed, we show that the typical linear re sizer can be replaced with learned resizers that can substantially improve performance. Importantly, while the classical re-sizers typically result in better perceptual quality of the downscaled images, our proposed learned resizers do not necessarily give better visual quality, but instead improve task performance.Our learned image resizer is jointly trained with a base-line vision model. This learned CNN-based resizer creates machine friendly visual manipulations that lead to a consistent improvement of the end task metric over the baseline model. Specifically, here we focus on the classification task with the ImageNet dataset [26], and experiment with four different models to learn resizers adapted to each model. Moreover, we show that the proposed resizer can also be useful for fine-tuning the classification baselines for other vision tasks. To this end, we experiment with three different baselines to develop image quality assessment (IQA) models on the AVA dataset [24].",2021,1980498754|1718280,semantic_scholar
15d6e1512089b07a66a3e5260848359cad79dbca,Recent Advances of Continual Learning in Computer Vision: An Overview,"In contrast to batch learning where all training data is available at once, continual learning represents a family of methods that accumulate knowledge and learn continuously with data available in sequential order. Similar to the human learning process with the ability of learning, fusing and accumulating new knowledge acquired at different time steps, continual learning is considered to have high practical significance. Hence, continual learning has been studied in various artificial intelligence tasks. In this paper, we present a comprehensive review of the recent progress of continual learning in computer vision. In particular, the works are grouped by their representative techniques, including regularisation, knowledge distillation, memory, generative replay, parameter isolation and a combination of the above techniques. For each category of these techniques, both its characteristics and applications in computer vision are presented. At the end of this overview, several subareas, where continuous knowledge accumulation is potentially helpful while continual learning has not been well studied, are discussed.",2021,2149526655|151475004|2112318242|2125614516|9756930,semantic_scholar
5b61a01b431e64c1c15f85b20e640176bf5addd4,A Comparative Study of Graph Matching Algorithms in Computer Vision,"The graph matching optimization problem is an essential component for many tasks in computer vision, such as bringing two deformable objects in correspondence. Naturally, a wide range of applicable algorithms have been proposed in the last decades. Since a common standard benchmark has not been developed, their performance claims are often hard to verify as evaluation on differing problem instances and criteria make the results incomparable. To address these shortcomings, we present a comparative study of graph matching algorithms. We create a uniform benchmark where we collect and categorize a large set of existing and publicly available computer vision graph matching problems in a common format. At the same time we collect and categorize the most popular open-source implementations of graph matching algorithms. Their performance is evaluated in a way that is in line with the best practices for comparing optimization algorithms. The study is designed to be reproducible and extensible to serve as a valuable resource in the future. Our study provides three notable insights: 1.) popular problem instances are exactly solvable in substantially less than 1 second and, therefore, are insufficient for future empirical evaluations; 2.) the most popular baseline methods are highly inferior to the best available methods; 3.) despite the NP-hardness of the problem, instances coming from vision applications are often solvable in a few seconds even for graphs with more than 500 vertices.",2022,37939429|2047405940|9047877|39600032|1756036|2374112|143657159|1792728,semantic_scholar
2a88f9b2524125c44c9de5738197ca4fcc7fe45e,Neural Architecture Search for Dense Prediction Tasks in Computer Vision,"The success of deep learning in recent years has lead to a rising demand for neural network architecture engineering. As a consequence, neural architecture search (NAS), which aims at automatically designing neural network architectures in a data-driven manner rather than manually, has evolved as a popular field of research. With the advent of weight sharing strategies across architectures, NAS has become applicable to a much wider range of problems. In particular, there are now many publications for dense prediction tasks in computer vision that require pixel-level predictions, such as semantic segmentation or object detection. These tasks come with novel challenges, such as higher memory footprints due to high-resolution data, learning multi-scale representations, longer training times, and more complex and larger neural architectures. In this manuscript, we provide an overview of NAS for dense prediction tasks by elaborating on these novel challenges and surveying ways to address them to ease future research and application of existing methods to novel problems.",2022,2501244|2151792792|2708564|40539032|1710872|2609831|144661829,semantic_scholar
b8cb9c0b02da96a9908665ae67692a6da4dd25a4,SCENIC: A JAX Library for Computer Vision Research and Beyond,"Scenic is an open-source11https://github.com/google-research/scenic JAX library with a focus on transformer-based models for computer vision research and beyond. The goal of this toolkit is to facilitate rapid experimentation, prototyping, and research of new architectures and models. Scenic supports a diverse range of tasks (e.g., classification, segmentation, detection) and facilitates working on multi-modal problems, along with GPU/TPU support for large-scale, multi-host and multi-device training. Scenic also offers optimized implementations of state-of-the-art research models spanning a wide range of modalities. Scenic has been successfully used for numerous projects and published papers and continues serving as the library of choice for rapid prototyping and publication of new research ideas.",2021,3226635|2194424|31638576|46352821|97947517,semantic_scholar
b4598816fc75106592f0d79ad59b0d75af1ce075,A survey on computer vision based human analysis in the COVID-19 era,"The emergence of COVID-19 has had a global and profound impact, not only on society as a whole, but also on the lives of individuals. Various prevention measures were introduced around the world to limit the transmission of the disease, including face masks, mandates for social distancing and regular disinfection in public spaces, and the use of screening applications. These developments also triggered the need for novel and improved computer vision techniques capable of (i) providing support to the prevention measures through an automated analysis of visual data, on the one hand, and (ii) facilitating normal operation of existing vision-based services, such as biometric authentication schemes, on the other. Especially important here, are computer vision techniques that focus on the analysis of people and faces in visual data and have been affected the most by the partial occlusions introduced by the mandates for facial masks. Such computer vision based human analysis techniques include face and face-mask detection approaches, face recognition techniques, crowd counting solutions, age and expression estimation procedures, models for detecting face-hand interactions and many others, and have seen considerable attention over recent years. The goal of this survey is to provide an introduction to the problems induced by COVID-19 into such research and to present a comprehensive review of the work done in the computer vision based human analysis field. Particular attention is paid to the impact of facial masks on the performance of various methods and recent solutions to mitigate this problem. Additionally, a detailed review of existing datasets useful for the development and evaluation of methods for COVID-19 related applications is also provided. Finally, to help advance the field further, a discussion on the main open challenges and future research direction is given at the end of the survey. This work is intended to have a broad appeal and be useful not only for computer vision researchers but also the general public.",2022,19325009|1410151432|2115945563|2265721|48046557|151491159|2286300|48670880|2064429921|2011218|3025777,semantic_scholar
ca377d0bfddc3c348acb9ba9f5f3041c2e93d8a5,Total Variation Optimization Layers for Computer Vision,"Optimization within a layer of a deep-net has emerged as a new direction for deep-net layer design. However, there are two main challenges when applying these layers to computer vision tasks: (a) which optimization problem within a layer is useful?; (b) how to ensure that computation within a layer remains efficient? To study question (a), in this work, we propose total variation (TV) minimization as a layer for computer vision. Motivated by the success of total variation in image processing, we hypothesize that TV as a layer provides useful inductive bias for deep-nets too. We study this hypothesis on five computer vision tasks: image classification, weakly supervised object localization, edge-preserving smoothing, edge detection, and image denoising, improving over existing baselines. To achieve these results we had to address question (b): we developed a GPU-based projected-Newton method which is 37× faster than existing solutions.",2022,28919105|2484223|10805888|2068227,semantic_scholar
a3b052c010c39aa02c0ba4fc1afb42a681a4bcd7,Transformer in Computer Vision,"Transformer is widely used in Natural Language Processing (NLP), in which numerous papers have been proposed. Recently, the transformer has been borrowed for many computer vision tasks. However, there are few papers to give a comprehensive survey on the vision-based transformer. To this end, we give an in-depth review of the vision-based transformer. We conclude 15 articles covering transformers on image object detection, multiple object tracking, action classification, and visual segmentation. Furthermore, we summarize 6 related datasets for corresponding tasks as well as their metrics. We also provide a comprehensive experimental comparison to validate the strength of transformer-based methods. We provide a brief introduction to the transformer and its applications on computer vision tasks, which can help beginners to recognize it.",2021,2135660426|2140562754|2151173088,semantic_scholar
a778a898d70d84c6e4193217ad572f37d0a2f502,Computer Vision-based Assistance System for the Visually Impaired Using Mobile Edge Artificial Intelligence,"Despite significant recent developments, visual assistance systems are still severely constrained by sensor capabilities, form factor, battery power consumption, computational resources and the use of traditional computer vision algorithms. Current visual assistance systems cannot adequately perform complex computer vision tasks that entail deep learning. We present the design and implementation of a novel visual assistance system that employs deep learning and point cloud processing to perform advanced perception tasks on a cost-effective, low-power mobile computing platform. The proposed system design circumvents the need for expensive, power-intensive Graphical Processing Unit (GPU)-based hardware required by most deep learning algorithms for real-time inference by employing instead edge Artificial Intelligence (AI) accelerators such as the Neural Compute Stick-2 (NCS2), model optimization techniques such as OpenVINO, and TensorFlow Lite, and smart depth sensors such as OpenCV AI Kit-Depth (OAK-D). Critical system design challenges such as training data collection, real-time capability, computational efficiency, power consumption, portability and reliability are addressed. The proposed system includes more advanced functionality than existing systems such as assessment of traffic conditions and detection and localization of hanging obstacles, crosswalks, moving obstacles and sudden elevation changes. The proposed system design incorporates an AI-based voice interface that allows for user-friendly interaction and control and is shown to realize a simple, cost-effective, power-efficient, portable and unobtrusive visual assistance device.",2021,2086666082|34735884|2085141|3422895,semantic_scholar
92e4ef5575f3f22f3f22526cd1fdfd2d0397d094,Deep Learning vs. Traditional Computer Vision,"Deep Learning has pushed the limits of what was possible in the domain of Digital Image Processing. However, that is not to say that the traditional computer vision techniques which had been undergoing progressive development in years prior to the rise of DL have become obsolete. This paper will analyse the benefits and drawbacks of each approach. The aim of this paper is to promote a discussion on whether knowledge of classical computer vision techniques should be maintained. The paper will also explore how the two sides of computer vision can be combined. Several recent hybrid methodologies are reviewed which have demonstrated the ability to improve computer vision performance and to tackle problems not suited to Deep Learning. For example, combining traditional computer vision techniques with Deep Learning has been popular in emerging domains such as Panoramic Vision and 3D vision for which Deep Learning models have not yet been fully optimised.",2019,3692743|145911154|133574842|116338962|1390095040|15909050|50207148|145975195,semantic_scholar
f2d32b9a81b78dbbccfa1616c019bbc32b2a8efb,Large image datasets: A pyrrhic win for computer vision?,"In this paper we investigate problematic practices and consequences of large scale vision datasets (LSVDs). We examine broad issues such as the question of consent and justice as well as specific concerns such as the inclusion of verifiably pornographic images in datasets. Taking the ImageNet-ILSVRC-2012 dataset as an example, we perform a cross-sectional model-based quantitative census covering factors such as age, gender, NSFW content scoring, class- wise accuracy, human-cardinality-analysis, and the semanticity of the image class information in order to statistically investigate the extent and subtleties of ethical transgressions. We then use the census to help hand-curate a look-up-table of images in the ImageNet-ILSVRC-2012 dataset that fall into the categories of verifiably pornographic: shot in a non-consensual setting (up-skirt), beach voyeuristic, and exposed private parts. We survey the landscape of harm and threats both the society at large and individuals face due to uncritical and ill-considered dataset curation practices. We then propose possible courses of correction and critique their pros and cons. We have duly open-sourced all of the code and the census meta-datasets generated in this endeavor for the computer vision community to build on. By unveiling the severity of the threats, our hope is to motivate the constitution of mandatory Institutional Review Boards (IRB) for large scale dataset curation.",2020,2670978|8318698,semantic_scholar
a23fbf6e7c224e696662b948163cb27e52188356,Events-To-Video: Bringing Modern Computer Vision to Event Cameras,"Event cameras are novel sensors that report brightness changes in the form of asynchronous ""events"" instead of intensity frames. They have significant advantages over conventional cameras: high temporal resolution, high dynamic range, and no motion blur. Since the output of event cameras is fundamentally different from conventional cameras, it is commonly accepted that they require the development of specialized algorithms to accommodate the particular nature of events. In this work, we take a different view and propose to apply existing, mature computer vision techniques to videos reconstructed from event data. We propose a novel, recurrent neural network to reconstruct videos from a stream of events and train it on a large amount of simulated event data. Our experiments show that our approach surpasses state-of-the-art reconstruction methods by a large margin (> 20%) in terms of image quality. We further apply off-the-shelf computer vision algorithms to videos reconstructed from event data on tasks such as object classification and visual-inertial odometry, and show that this strategy consistently outperforms algorithms that were specifically designed for event data. We believe that our approach opens the door to bringing the outstanding properties of event cameras to an entirely new range of tasks.",2019,3414274|2774325|145231047|2075371,semantic_scholar
107eb32e949b2396a9750283eeeaf745123acc79,I Find Your Lack of Uncertainty in Computer Vision Disturbing,"Neural networks are used for many real world applications, but often they have problems estimating their own confidence. This is particularly problematic for computer vision applications aimed at making high stakes decisions with humans and their lives. In this paper we make a meta-analysis of the literature, showing that most if not all computer vision applications do not use proper epistemic uncertainty quantification, which means that these models ignore their own limitations. We describe the consequences of using models without proper uncertainty quantification, and motivate the community to adopt versions of the models they use that have proper calibrated epistemic uncertainty, in order to enable out of distribution detection. We close the paper with a summary of challenges on estimating uncertainty for computer vision applications and recommendations.",2021,1399503242,semantic_scholar
90f219f4982daf25b28267476c0853f0ed5e133e,Computer Vision Syndrome in the Spanish Population during the COVID-19 Lockdown,"Supplemental digital content is available in the text. SIGNIFICANCE After 6 to 8 weeks of mandatory lockdown due to coronavirus disease 2019 (COVID-19) in Spain, the encouraged change in daily habits resulted in a significant increase in electronic device use. Computer vision syndrome–related symptoms were reported more often in participants who used electronic device for more time and spent less time outdoors. PURPOSE The main purpose of this study was to evaluate computer vision syndrome–related eye symptoms due to the use of electronic devices during COVID-19 lockdown decreed in Spain in 2020. METHODS After 6 to 8 weeks of strict lockdown, a total of 730 participants (18 to 73 years old) filled in a customized questionnaire divided into three sections: (1) general demographics, (2) usage habits of electronic devices during this period, and (3) computer vision syndrome–related ocular and visual symptoms associated with their use and with ergonomic practices. RESULTS The daily duration of use of electronic devices increased an average of 3.1 ± 2.2 h/d during the lockdown, with computer use increasing the most. The main symptoms reported by the participants were headache (36.7%), dry eye (31.1%), irritation (24.1%), blurred vision (21.2%), and ocular pain (14.9%). There was a significant relationship between computer vision syndrome–related symptoms and age (greater in participants between 18 and 30 years old than in those older than 45 years, P < .001), primary activity (greater in studying from home and remote working, P < .001), and extended periods of electronic device use (greater when used more than 10 h/d, P = .05). Symptoms were also associated with time spent outdoors (greater in participants with <1 h/d, P = .02). CONCLUSIONS The lockdown due to COVID-19 showed an increase in the electronic device use. Participants who spent more time with electronic devices and less time outdoors reported more computer vision syndrome–related eye symptoms.",2021,1403437114|2126494348|1404737523|79851334|1402292366|1398378431,semantic_scholar
056eaaeec68420286a80c3f593b7711d5cc17ef6,Kornia: an Open Source Differentiable Computer Vision Library for PyTorch,"This work presents Kornia – an open source computer vision library which consists of a set of differentiable routines and modules to solve generic computer vision problems. The package uses PyTorch as its main backend both for efficiency and to take advantage of the reverse-mode auto-differentiation to define and compute the gradient of complex functions. Inspired by OpenCV, Kornia is composed of a set of modules containing operators that can be inserted inside neural networks to train models to perform image transformations, camera calibration, epipolar geometry, and low level image processing techniques, such as filtering and edge detection that operate directly on high dimensional tensor representations. Examples of classical vision problems implemented using our framework are provided including a benchmark comparing to existing vision libraries.",2019,10044589|40369725|1786419|2383373|1720184,semantic_scholar
