id,title,abstract,year,author_ids,source
b2961394ecb6051ffe1847fcc9e5eb7685d3ec6d,Inverse Reinforcement Learning without Reinforcement Learning,"Inverse Reinforcement Learning (IRL) is a powerful set of techniques for imitation learning that aims to learn a reward function that rationalizes expert demonstrations. Unfortunately, traditional IRL methods suffer from a computational weakness: they require repeatedly solving a hard reinforcement learning (RL) problem as a subroutine. This is counter-intuitive from the viewpoint of reductions: we have reduced the easier problem of imitation learning to repeatedly solving the harder problem of RL. Another thread of work has proved that access to the side-information of the distribution of states where a strong policy spends time can dramatically reduce the sample and computational complexities of solving an RL problem. In this work, we demonstrate for the first time a more informed imitation learning reduction where we utilize the state distribution of the expert to alleviate the global exploration component of the RL subroutine, providing an exponential speedup in theory. In practice, we find that we are able to significantly speed up the prior art on continuous control tasks.",2023,2073365488|2118208649|2487768|1756566|1768074,semantic_scholar
460c3bcb289b0771accead06c9bfc10f9bbc7795,"Multi-Objective Reinforcement Learning: Convexity, Stationarity and Pareto Optimality",,2023,2272314879|94722394|40508553,semantic_scholar
067239c3a60c8649db4ab2791a8bbddb7b4c7c99,SafeDreamer: Safe Reinforcement Learning with World Models,"The deployment of Reinforcement Learning (RL) in real-world applications is constrained by its failure to satisfy safety criteria. Existing Safe Reinforcement Learning (SafeRL) methods, which rely on cost functions to enforce safety, often fail to achieve zero-cost performance in complex scenarios, especially vision-only tasks. These limitations are primarily due to model inaccuracies and inadequate sample efficiency. The integration of the world model has proven effective in mitigating these shortcomings. In this work, we introduce SafeDreamer, a novel algorithm incorporating Lagrangian-based methods into world model planning processes within the superior Dreamer framework. Our method achieves nearly zero-cost performance on various tasks, spanning low-dimensional and vision-only input, within the Safety-Gymnasium benchmark, showcasing its efficacy in balancing performance and safety in RL tasks. Further details can be found in the code repository: \url{https://github.com/PKU-Alignment/SafeDreamer}.",2023,2217835779|2154630502|2349073608|2404684449|2116764844,semantic_scholar
3714ed902e79dad5dcc93c5d033c8222d044f3c8,Reinforcement Learning from Automatic Feedback for High-Quality Unit Test Generation,"Software testing is a crucial but time-consuming aspect of software development, and recently, Large Language Models (LLMs) have gained popularity for automated test case generation. However, because LLMs are trained on vast amounts of open-source code, they often generate test cases that do not adhere to best practices and may even contain test smells (anti-patterns). To address this issue, we propose Reinforcement Learning from Static Quality Metrics (RLSQM), wherein we utilize Reinforcement Learning to generate high-quality unit tests based on static analysis-based quality metrics. First, we analyzed LLM-generated tests and show that LLMs frequently do generate undesirable test smells — up to 37% of the time. Then, we implemented lightweight static analysis-based reward model and trained LLMs using this reward model to optimize for five code quality metrics. Our experimental results demonstrate that the RL-optimized Codex model consistently generated higher-quality test cases than the base LLM, improving quality metrics by up to 23%, and generated nearly 100% syntactically-correct code. RLSQM also outperformed GPT-4 on all code quality metrics, in spite of training a substantially cheaper Codex model. We provide insights into how reliably utilize RL to improve test generation quality and show that RLSQM is a significant step towards enhancing the overall efficiency and reliability of automated software testing. Our data are available at this link: https://doi.org/10.6084/m9.figshare.25983166.",2023,2108813860|40626221|145507437|2061625488,semantic_scholar
2032aa3ea996e32b45890e9d5bfae4638af2b3cc,Dynamic datasets and market environments for financial reinforcement learning,"The financial market is a particularly challenging playground for deep reinforcement learning due to its unique feature of dynamic datasets. Building high-quality market environments for training financial reinforcement learning (FinRL) agents is difficult due to major factors such as the low signal-to-noise ratio of financial data, survivorship bias of historical data, and model overfitting. In this paper, we present an updated version of FinRL-Meta, a data-centric and openly accessible library that processes dynamic datasets from real-world markets into gym-style market environments and has been actively maintained by the AI4Finance community. First, following a DataOps paradigm, we provide hundreds of market environments through an automatic data curation pipeline. Second, we provide homegrown examples and reproduce popular research papers as stepping stones for users to design new trading strategies. We also deploy the library on cloud platforms so that users can visualize their own results and assess the relative performance via community-wise competitions. Third, we provide dozens of Jupyter/Python demos organized into a curriculum and a documentation website to serve the rapidly growing community. The codes are available at https://github.com/AI4Finance-Foundation/FinRL-Meta",2023,4029028|2186589721|1504453822|1505808706|1759658|2152184398|2118324724|50218397|2148900809,semantic_scholar
c7a7b63cc3f257f718525a563a6817b99f788d70,Explaining Reinforcement Learning with Shapley Values,"For reinforcement learning systems to be widely adopted, their users must understand and trust them. We present a theoretical analysis of explaining reinforcement learning using Shapley values, following a principled approach from game theory for identifying the contribution of individual players to the outcome of a cooperative game. We call this general framework Shapley Values for Explaining Reinforcement Learning (SVERL). Our analysis exposes the limitations of earlier uses of Shapley values in reinforcement learning. We then develop an approach that uses Shapley values to explain agent performance. In a variety of domains, SVERL produces meaningful explanations that match and supplement human intuition.",2023,2219860269|2220639633|2510156,semantic_scholar
24b2fdff9ab11e9d5782819edadb3cfdf41cd7db,Action-Quantized Offline Reinforcement Learning for Robotic Skill Learning,"The offline reinforcement learning (RL) paradigm provides a general recipe to convert static behavior datasets into policies that can perform better than the policy that collected the data. While policy constraints, conservatism, and other methods for mitigating distributional shifts have made offline reinforcement learning more effective, the continuous action setting often necessitates various approximations for applying these techniques. Many of these challenges are greatly alleviated in discrete action settings, where offline RL constraints and regularizers can often be computed more precisely or even exactly. In this paper, we propose an adaptive scheme for action quantization. We use a VQ-VAE to learn state-conditioned action quantization, avoiding the exponential blowup that comes with na\""ive discretization of the action space. We show that several state-of-the-art offline RL methods such as IQL, CQL, and BRAC improve in performance on benchmarks when combined with our proposed discretization scheme. We further validate our approach on a set of challenging long-horizon complex robotic manipulation tasks in the Robomimic environment, where our discretized offline RL algorithms are able to improve upon their continuous counterparts by 2-3x. Our project page is at https://saqrl.github.io/",2023,2238220544|2259962143|2259992440|1488785534|3468192|2249615151,semantic_scholar
d91591feb96936237167c9e569b8f74e0b2bfcc3,Benchmarking Offline Reinforcement Learning on Real-Robot Hardware,"Learning policies from previously recorded data is a promising direction for real-world robotics tasks, as online learning is often infeasible. Dexterous manipulation in particular remains an open problem in its general form. The combination of offline reinforcement learning with large diverse datasets, however, has the potential to lead to a breakthrough in this challenging domain analogously to the rapid progress made in supervised learning in recent years. To coordinate the efforts of the research community toward tackling this problem, we propose a benchmark including: i) a large collection of data for offline learning from a dexterous manipulation platform on two tasks, obtained with capable RL agents trained in simulation; ii) the option to execute learned policies on a real-world robotic system and a simulation for efficient debugging. We evaluate prominent open-sourced offline reinforcement learning algorithms on the datasets and provide a reproducible experimental setup for offline reinforcement learning on real systems.",2023,50057572|46773173|2662064|47804478|36661824|153125952|1707625|144247521,semantic_scholar
69b80ce5ab6c2263b145b1eaa23664145938f351,The Primacy Bias in Deep Reinforcement Learning,"This work identifies a common flaw of deep reinforcement learning (RL) algorithms: a tendency to rely on early interactions and ignore useful evidence encountered later. Because of training on progressively growing datasets, deep RL agents incur a risk of overfitting to earlier experiences, negatively affecting the rest of the learning process. Inspired by cognitive science, we refer to this effect as the primacy bias. Through a series of experiments, we dissect the algorithmic aspects of deep RL that exacerbate this bias. We then propose a simple yet generally-applicable mechanism that tackles the primacy bias by periodically resetting a part of the agent. We apply this mechanism to algorithms in both discrete (Atari 100k) and continuous action (DeepMind Control Suite) domains, consistently improving their performance.",2022,101169516|51881243|1410392725|145180695|2058336670,semantic_scholar
bcc5820c7a84f84347bbf1062dcf7330fe2b0870,Reasoning with Latent Diffusion in Offline Reinforcement Learning,"Offline reinforcement learning (RL) holds promise as a means to learn high-reward policies from a static dataset, without the need for further environment interactions. However, a key challenge in offline RL lies in effectively stitching portions of suboptimal trajectories from the static dataset while avoiding extrapolation errors arising due to a lack of support in the dataset. Existing approaches use conservative methods that are tricky to tune and struggle with multi-modal data (as we show) or rely on noisy Monte Carlo return-to-go samples for reward conditioning. In this work, we propose a novel approach that leverages the expressiveness of latent diffusion to model in-support trajectory sequences as compressed latent skills. This facilitates learning a Q-function while avoiding extrapolation error via batch-constraining. The latent space is also expressive and gracefully copes with multi-modal data. We show that the learned temporally-abstract latent space encodes richer task-specific information for offline RL tasks as compared to raw state-actions. This improves credit assignment and facilitates faster reward propagation during Q-learning. Our method demonstrates state-of-the-art performance on the D4RL benchmarks, particularly excelling in long-horizon, sparse-reward tasks.",2023,1598370068|1999785394|38527583|2239202160|2239201978|2253652688,semantic_scholar
2ec8d85cb9c0fac9d3a3aee838b6b696599ee11d,Reinforcement learning tutor better supported lower performers in a math task,"Resource limitations make it challenging to provide all students with one of the most effective educational interventions: personalized instruction. Reinforcement learning could be a pivotal tool to decrease the development costs and enhance the effectiveness of intelligent tutoring software, that aims to provide the right support, at the right time, to a student. Here we illustrate that deep reinforcement learning can be used to provide adaptive pedagogical support to students learning about the concept of volume in a narrative storyline software. Using explainable artificial intelligence tools, we extracted interpretable insights about the pedagogical policy learned and demonstrated that the resulting policy had similar performance in a different student population. Most importantly, in both studies, the reinforcement-learning narrative system had the largest benefit for those students with the lowest initial pretest scores, suggesting the opportunity for AI to adapt and provide support for those most in need.",2023,3451759|21771052|2187934110|2153100619|2214943467|2399559955|71222706|2346645140|2117936391|91552596|9522307|2563117,semantic_scholar
ba177bc2aa536d46a945dbba342c09539907360b,Utilizing reinforcement learning for de novo drug design,"Deep learning-based approaches for generating novel drug molecules with specific properties have gained a lot of interest in the last few years. Recent studies have demonstrated promising performance for string-based generation of novel molecules utilizing reinforcement learning. In this paper, we develop a unified framework for using reinforcement learning for de novo drug design, wherein we systematically study various on- and off-policy reinforcement learning algorithms and replay buffers to learn an RNN-based policy to generate novel molecules predicted to be active against the dopamine receptor DRD2. Our findings suggest that it is advantageous to use at least both top-scoring and low-scoring molecules for updating the policy when structural diversity is essential. Using all generated molecules at an iteration seems to enhance performance stability for on-policy algorithms. In addition, when replaying high, intermediate, and low-scoring molecules, off-policy algorithms display the potential of improving the structural diversity and number of active molecules generated, but possibly at the cost of a longer exploration phase. Our work provides an open-source framework enabling researchers to investigate various reinforcement learning methods for de novo drug design.",2023,2132830715|2231021|2859540|51012729,semantic_scholar
738b8695e52756833aaf4b25cf230c44f87e6e0c,RLIF: Interactive Imitation Learning as Reinforcement Learning,"Although reinforcement learning methods offer a powerful framework for automatic skill acquisition, for practical learning-based control problems in domains such as robotics, imitation learning often provides a more convenient and accessible alternative. In particular, an interactive imitation learning method such as DAgger, which queries a near-optimal expert to intervene online to collect correction data for addressing the distributional shift challenges that afflict na\""ive behavioral cloning, can enjoy good performance both in theory and practice without requiring manually specified reward functions and other components of full reinforcement learning methods. In this paper, we explore how off-policy reinforcement learning can enable improved performance under assumptions that are similar but potentially even more practical than those of interactive imitation learning. Our proposed method uses reinforcement learning with user intervention signals themselves as rewards. This relaxes the assumption that intervening experts in interactive imitation learning should be near-optimal and enables the algorithm to learn behaviors that improve over the potential suboptimal human expert. We also provide a unified framework to analyze our RL method and DAgger; for which we present the asymptotic analysis of the suboptimal gap for both methods as well as the non-asymptotic sample complexity bound of our method. We then evaluate our method on challenging high-dimensional continuous control simulation benchmarks as well as real-world robotic vision-based manipulation tasks. The results show that it strongly outperforms DAgger-like approaches across the different tasks, especially when the intervening experts are suboptimal. Code and videos can be found on the project website: https://rlif-page.github.io",2023,2238220544|2259962143|119692515|2255716385|2249615151,semantic_scholar
61e7a3d5606043594a8ce377870479f77a6b58c2,"A Survey on Offline Reinforcement Learning: Taxonomy, Review, and Open Problems","With the widespread adoption of deep learning, reinforcement learning (RL) has experienced a dramatic increase in popularity, scaling to previously intractable problems, such as playing complex games from pixel observations, sustaining conversations with humans, and controlling robotic agents. However, there is still a wide range of domains inaccessible to RL due to the high cost and danger of interacting with the environment. Offline RL is a paradigm that learns exclusively from static datasets of previously collected interactions, making it feasible to extract policies from large and diverse training datasets. Effective offline RL algorithms have a much wider range of applications than online RL, being particularly appealing for real-world applications, such as education, healthcare, and robotics. In this work, we contribute with a unifying taxonomy to classify offline RL methods. Furthermore, we provide a comprehensive review of the latest algorithmic breakthroughs in the field using a unified notation as well as a review of existing benchmarks’ properties and shortcomings. Additionally, we provide a figure that summarizes the performance of each method and class of methods on different dataset properties, equipping researchers with the tools to decide which type of algorithm is best suited for the problem at hand and identify which classes of algorithms look the most promising. Finally, we provide our perspective on open problems and propose future research directions for this rapidly growing field.",2022,2315128740|31720494|2210164,semantic_scholar
af69e9c4953780d8e68119b1d3e8fdd23bda5f20,Emergence of In-Context Reinforcement Learning from Noise Distillation,"Recently, extensive studies in Reinforcement Learning have been carried out on the ability of transformers to adapt in-context to various environments and tasks. Current in-context RL methods are limited by their strict requirements for data, which needs to be generated by RL agents or labeled with actions from an optimal policy. In order to address this prevalent problem, we propose AD$^\varepsilon$, a new data acquisition approach that enables in-context Reinforcement Learning from noise-induced curriculum. We show that it is viable to construct a synthetic noise injection curriculum which helps to obtain learning histories. Moreover, we experimentally demonstrate that it is possible to alleviate the need for generation using optimal policies, with in-context RL still able to outperform the best suboptimal policy in a learning dataset by a 2x margin.",2023,2183657382|1390186081|2155646949|2275244094|2275245076,semantic_scholar
e06c005e98281af455c454ce2478285f6f3afeca,Mastering Visual Continuous Control: Improved Data-Augmented Reinforcement Learning,"We present DrQ-v2, a model-free reinforcement learning (RL) algorithm for visual continuous control. DrQ-v2 builds on DrQ, an off-policy actor-critic approach that uses data augmentation to learn directly from pixels. We introduce several improvements that yield state-of-the-art results on the DeepMind Control Suite. Notably, DrQ-v2 is able to solve complex humanoid locomotion tasks directly from pixel observations, previously unattained by model-free RL. DrQ-v2 is conceptually simple, easy to implement, and provides significantly better computational footprint compared to prior work, with the majority of tasks taking just 8 hours to train on a single GPU. Finally, we publicly release DrQ-v2's implementation to provide RL practitioners with a strong and computationally efficient baseline.",2021,13759615|2276554|3254390|34026610,semantic_scholar
45f573f302dc7e77cbc5d1a74ccbac3564bbebc8,PEBBLE: Feedback-Efficient Interactive Reinforcement Learning via Relabeling Experience and Unsupervised Pre-training,"Conveying complex objectives to reinforcement learning (RL) agents can often be difficult, involving meticulous design of reward functions that are sufficiently informative yet easy enough to provide. Human-in-the-loop RL methods allow practitioners to instead interactively teach agents through tailored feedback; however, such approaches have been challenging to scale since human feedback is very expensive. In this work, we aim to make this process more sample- and feedback-efficient. We present an off-policy, interactive RL algorithm that capitalizes on the strengths of both feedback and off-policy learning. Specifically, we learn a reward model by actively querying a teacher's preferences between two clips of behavior and use it to train an agent. To enable off-policy learning, we relabel all the agent's past experience when its reward model changes. We additionally show that pre-training our agents with unsupervised exploration substantially increases the mileage of its queries. We demonstrate that our approach is capable of learning tasks of higher complexity than previously considered by human-in-the-loop methods, including a variety of locomotion and robotic manipulation skills. We also show that our method is able to utilize real-time human feedback to effectively prevent reward exploitation and learn new behaviors that are difficult to specify with standard reward functions.",2021,3436470|152447364|1689992,semantic_scholar
27302766f8d0eb6c052eb400e234c5be0e7a767e,Trust Region Policy Optimisation in Multi-Agent Reinforcement Learning,"Trust region methods rigorously enabled reinforcement learning (RL) agents to learn monotonically improving policies, leading to superior performance on a variety of tasks. Unfortunately, when it comes to multi-agent reinforcement learning (MARL), the property of monotonic improvement may not simply apply; this is because agents, even in cooperative games, could have conflicting directions of policy updates. As a result, achieving a guaranteed improvement on the joint policy where each agent acts individually remains an open challenge. In this paper, we extend the theory of trust region learning to MARL. Central to our findings are the multi-agent advantage decomposition lemma and the sequential policy update scheme. Based on these, we develop Heterogeneous-Agent Trust Region Policy Optimisation (HATPRO) and Heterogeneous-Agent Proximal Policy Optimisation (HAPPO) algorithms. Unlike many existing MARL algorithms, HATRPO/HAPPO do not need agents to share parameters, nor do they need any restrictive assumptions on decomposibility of the joint value function. Most importantly, we justify in theory the monotonic improvement property of HATRPO/HAPPO. We evaluate the proposed methods on a series of Multi-Agent MuJoCo and StarCraftII tasks. Results show that HATRPO and HAPPO significantly outperform strong baselines such as IPPO, MAPPO and MADDPG on all tested tasks, therefore establishing a new state of the art.",2021,2126704872|2118230909|2130205050|50531782|3003954|48094081|47796324,semantic_scholar
2319a491378867c7049b3da055c5df60e1671158,Playing Atari with Deep Reinforcement Learning,"We present the first deep learning model to successfully learn control policies directly from high-dimensional sensory input using reinforcement learning. The model is a convolutional neural network, trained with a variant of Q-learning, whose input is raw pixels and whose output is a value function estimating future rewards. We apply our method to seven Atari 2600 games from the Arcade Learning Environment, with no adjustment of the architecture or learning algorithm. We find that it outperforms all previous approaches on six of the games and surpasses a human expert on three of them.",2013,3255983|2645384|145824029|1753223|2460849|1688276|3137672,semantic_scholar
362cc80481b288874af0428107ab31e955dcf09f,Offline Reinforcement Learning with Fisher Divergence Critic Regularization,"Many modern approaches to offline Reinforcement Learning (RL) utilize behavior regularization, typically augmenting a model-free actor critic algorithm with a penalty measuring divergence of the policy from the offline data. In this work, we propose an alternative approach to encouraging the learned policy to stay close to the data, namely parameterizing the critic as the log-behavior-policy, which generated the offline data, plus a state-action value offset term, which can be learned using a neural network. Behavior regularization then corresponds to an appropriate regularizer on the offset term. We propose using a gradient penalty regularizer for the offset term and demonstrate its equivalence to Fisher divergence regularization, suggesting connections to the score matching and generative energy-based model literature. We thus term our resulting algorithm Fisher-BRC (Behavior Regularized Critic). On standard offline RL benchmarks, Fisher-BRC achieves both improved performance and faster convergence over existing state-of-the-art methods.",2021,2000906|2704494|2276554|7624658,semantic_scholar
